<?xml version="1.0" encoding="UTF-8"?>
<!DOCTYPE element SYSTEM "elements.dtd">
<element series="alkali-earth-metal">
   <name>Calcium</name>
   <symbol>Ca</symbol>
   <atomic-number>20</atomic-number>
   <mass-number>40</mass-number>
   <electronegativity>1.00</electronegativity>
   <covalent-radius>1.74</covalent-radius>
   <atomic-radius>2.23</atomic-radius>
   <melting-point>1112.0</melting-point>
   <boiling-point>1757.0</boiling-point>
   <density>1.55</density>
   <specific-heat>0.63</specific-heat>
   <electrical-conductivity>0.298e6</electrical-conductivity>
   <thermal-conductivity>2.0</thermal-conductivity>
</element>
